[
  {"id":"C01","title":"Generally well","family":"healthy","gateway":{"signals":[],"healthy":true},"script":[],"expect":{"terminalSignals":{},"forbiddenBranches":["problem-investigation"],"driverKnowable":false,"exitClass":"healthy-goal","maxQuestions":3}},
  {"id":"C02","title":"Generally well with improvement goal","family":"healthy","gateway":{"signals":[],"healthy":true},"script":[{"when":{"move":"healthy-goal"},"answer":"build-habit"}],"expect":{"terminalSignals":{},"driverKnowable":false,"exitClass":"healthy-goal","maxQuestions":3}},
  {"id":"C03","title":"Single clear sleep concern","family":"single-clear","gateway":{"signals":["sleep"]},"script":[{"when":{"signal":"sleep","move":"scope"},"answer":"meaningful-problem"},{"when":{"signal":"sleep","move":"frequency"},"answer":"often"}],"expect":{"terminalSignals":{"sleep":"confirmed"},"driverKnowable":false,"exitClass":"resolved","maxQuestions":4}},
  {"id":"C04","title":"Work concern without money","family":"cross-domain-negative","gateway":{"signals":["work"]},"script":[{"when":{"signal":"work"},"answer":"workload"}],"expect":{"terminalSignals":{"work":"confirmed"},"forbiddenBranches":["money"],"driverKnowable":true,"exitClass":"resolved","maxQuestions":5}},
  {"id":"C05","title":"Single money concern","family":"single-clear","gateway":{"signals":["money"]},"script":[{"when":{"signal":"money","move":"driver-discriminate"},"answer":["expenses"]}],"expect":{"terminalSignals":{"money":"confirmed"},"requiredDrivers":["expenses"],"driverKnowable":true,"exitClass":"resolved","maxQuestions":5}},
  {"id":"C06","title":"Money multiple sources","family":"multi-driver","gateway":{"signals":["money"]},"script":[{"when":{"signal":"money","move":"driver-discriminate"},"answer":["no-income","debt","expenses"]}],"expect":{"terminalSignals":{"money":"confirmed"},"requiredDrivers":["no-income","debt","expenses"],"driverKnowable":true,"exitClass":"resolved","maxQuestions":5}},
  {"id":"C07","title":"Work-school contradiction","family":"contradiction","gateway":{"signals":["work"]},"script":[{"when":{"signal":"work","move":"scope"},"answer":"nothing-major"},{"when":{"move":"contradiction-clarification"},"answer":"actually-not-an-issue"}],"expect":{"terminalSignals":{"work":"cleared"},"forbiddenBranches":["money"],"driverKnowable":false,"exitClass":"resolved","maxQuestions":4,"mustClarifyContradiction":true}},
  {"id":"C08","title":"Focus unknown cause","family":"uncertainty","gateway":{"signals":["focus"]},"script":[{"when":{"signal":"focus","move":"driver-discriminate"},"answer":"not-sure"},{"when":{"signal":"focus","move":"impact"},"answer":"difficult"},{"when":{"signal":"focus","move":"frequency"},"answer":"often"}],"expect":{"terminalSignals":{"focus":"confirmed"},"driverKnowable":false,"exitClass":"unresolved","maxQuestions":6,"mustPivotOnUncertainty":true}},
  {"id":"C09","title":"Repeated causal uncertainty","family":"uncertainty","gateway":{"signals":["focus"]},"script":[{"when":{"move":"driver-discriminate"},"answer":"not-sure"},{"when":{"move":"impact"},"answer":"mixed"},{"when":{"move":"frequency"},"answer":"sometimes"}],"expect":{"terminalSignals":{"focus":"unresolved"},"driverKnowable":false,"exitClass":"unresolved","maxQuestions":6,"mustPivotOnUncertainty":true}},
  {"id":"C10","title":"Relationships home focus no health","family":"cross-domain-negative","gateway":{"signals":["relationships","home","focus"]},"script":[],"expect":{"terminalSignals":{"relationships":"deferred","home":"deferred","focus":"deferred"},"forbiddenBranches":["health","energy"],"driverKnowable":false,"exitClass":"deferred"}},
  {"id":"C11","title":"Three independent concerns","family":"multi-signal","gateway":{"signals":["money","relationships","activity"]},"script":[],"expect":{"terminalSignals":{"money":"deferred","relationships":"deferred","activity":"deferred"},"driverKnowable":false,"exitClass":"deferred"}},
  {"id":"C12","title":"Connected work to money with evidence","family":"cross-domain-positive","gateway":{"signals":["work"]},"script":[{"when":{"signal":"work"},"answer":"lost-job-no-income"}],"expect":{"terminalSignals":{"work":"confirmed"},"allowedCandidates":["money"],"requiredDrivers":["no-income"],"driverKnowable":true,"exitClass":"resolved"}},
  {"id":"C13","title":"Work money association unsupported","family":"cross-domain-negative","gateway":{"signals":["work"]},"script":[{"when":{"signal":"work"},"answer":"coworker-conflict"}],"expect":{"terminalSignals":{"work":"confirmed"},"forbiddenBranches":["money"],"driverKnowable":true,"exitClass":"resolved"}},
  {"id":"C14","title":"Member correction clears candidate","family":"correction","gateway":{"signals":["sleep"]},"script":[{"when":{"signal":"sleep"},"answer":"schedule"},{"when":{"move":"correction"},"answer":"schedule-is-not-the-problem"}],"expect":{"terminalSignals":{"sleep":"confirmed"},"forbiddenBranches":["schedule-driver-confirmed"],"driverKnowable":false,"exitClass":"unresolved"}},
  {"id":"C15","title":"One concern clears another remains","family":"multi-signal","gateway":{"signals":["work","sleep"]},"script":[{"when":{"signal":"work"},"answer":"actually-not-an-issue"},{"when":{"signal":"sleep"},"answer":"meaningful-problem"}],"expect":{"terminalSignals":{"work":"cleared","sleep":"confirmed"},"driverKnowable":false,"exitClass":"resolved"}},
  {"id":"C16","title":"Short route strong evidence","family":"burden","gateway":{"signals":["sleep"]},"script":[{"when":{"signal":"sleep"},"answer":"clear-direct-evidence"}],"expect":{"terminalSignals":{"sleep":"confirmed"},"driverKnowable":true,"exitClass":"resolved","maxQuestions":4}},
  {"id":"C17","title":"Weak evidence unresolved","family":"uncertainty","gateway":{"signals":["energy"]},"script":[{"when":{"signal":"energy"},"answer":"unclear"}],"expect":{"terminalSignals":{"energy":"unresolved"},"driverKnowable":false,"exitClass":"unresolved"}},
  {"id":"C18","title":"Member opt out","family":"exit","gateway":{"signals":["money"]},"script":[{"when":{"move":"any"},"answer":"opt-out"}],"expect":{"terminalSignals":{"money":"deferred"},"driverKnowable":false,"exitClass":"opt-out","maxQuestions":3}},
  {"id":"C19","title":"Global ceiling preserves unresolved","family":"budget","gateway":{"signals":["money","sleep","relationships"]},"script":[],"expect":{"terminalSignals":{"money":"deferred","sleep":"deferred","relationships":"deferred"},"driverKnowable":false,"exitClass":"deferred"}},
  {"id":"C20","title":"Several concerns no silent drop","family":"multi-signal","gateway":{"signals":["money","work","focus"]},"script":[],"expect":{"terminalSignals":{"money":"deferred","work":"deferred","focus":"deferred"},"driverKnowable":false,"exitClass":"deferred"}},
  {"id":"C21","title":"None distinct from not sure","family":"healthy","gateway":{"signals":[],"healthy":true},"script":[],"expect":{"terminalSignals":{},"forbiddenBranches":["uncertainty-recovery"],"driverKnowable":false,"exitClass":"healthy-goal","maxQuestions":3}},
  {"id":"C22","title":"Observable severity no not-sure dependency","family":"question-design","gateway":{"signals":["sleep"]},"script":[{"when":{"move":"impact"},"answer":"very-difficult"}],"expect":{"terminalSignals":{"sleep":"confirmed"},"driverKnowable":false,"exitClass":"resolved"}},
  {"id":"C23","title":"Other unmodeled money cause","family":"other","gateway":{"signals":["money"]},"script":[{"when":{"move":"driver-discriminate"},"answer":["other"]}],"expect":{"terminalSignals":{"money":"confirmed"},"driverKnowable":false,"exitClass":"unresolved"}},
  {"id":"C24","title":"Candidate driver contradicted","family":"contradiction","gateway":{"signals":["sleep"]},"script":[{"when":{"move":"driver-discriminate"},"answer":"schedule"},{"when":{"move":"confirm"},"answer":"no"}],"expect":{"terminalSignals":{"sleep":"confirmed"},"forbiddenBranches":["schedule-driver-confirmed"],"driverKnowable":false,"exitClass":"unresolved","mustClarifyContradiction":true}},
  {"id":"C25","title":"Cleared concern explicitly reintroduced","family":"correction","gateway":{"signals":["work"]},"script":[{"when":{"signal":"work"},"answer":"actually-not-an-issue"},{"when":{"move":"explicit-new-evidence"},"answer":"work-is-now-a-problem"}],"expect":{"terminalSignals":{"work":"confirmed"},"driverKnowable":false,"exitClass":"resolved"}},
  {"id":"C26","title":"Supported physical to sleep bridge","family":"cross-domain-positive","gateway":{"signals":["energy"]},"script":[{"when":{"signal":"energy"},"answer":"sleeping-three-hours"}],"expect":{"terminalSignals":{"energy":"confirmed"},"allowedCandidates":["sleep"],"requiredDrivers":["poor-sleep"],"driverKnowable":true,"exitClass":"resolved"}},
  {"id":"C27","title":"Energy without sleep evidence","family":"cross-domain-negative","gateway":{"signals":["energy"]},"script":[{"when":{"signal":"energy"},"answer":"only-after-exertion"}],"expect":{"terminalSignals":{"energy":"confirmed"},"forbiddenBranches":["sleep"],"driverKnowable":false,"exitClass":"unresolved"}},
  {"id":"C28","title":"Safety signal mid interview","family":"safety","gateway":{"signals":["stress"]},"script":[{"when":{"move":"safety-trigger"},"answer":"positive"}],"expect":{"terminalSignals":{"stress":"deferred"},"driverKnowable":false,"exitClass":"safety-interrupt","safetyInterrupt":true}},
  {"id":"C29","title":"Safety negative control","family":"safety","gateway":{"signals":["stress"]},"script":[{"when":{"move":"safety-check"},"answer":"negative"}],"expect":{"terminalSignals":{"stress":"confirmed"},"driverKnowable":false,"exitClass":"resolved","safetyInterrupt":false}},
  {"id":"C30","title":"No false resolution at ceiling","family":"budget","gateway":{"signals":["focus"]},"script":[{"when":{"move":"driver-discriminate"},"answer":"not-sure"}],"expect":{"terminalSignals":{"focus":"unresolved"},"driverKnowable":false,"exitClass":"unresolved","mustPivotOnUncertainty":true}}
]
